{
  "$schema": "../schema.json",
  "schemaVersion": 1,
  "revision": "2026-10-24",
  "manufacturer": "Vishay",
  "component": "resistor",
  "stock": {
    "status": "unknown",
    "checkedAt": null
  },
  "id": "vishay-tnpw-e3",
  "name": "Vishay TNPW e3",
  "encoding": "rkm4",
  "prefix": "TNPW",
  "sources": [
    {
      "id": "vishay-28758",
      "title": "Vishay TNPW e3",
      "url": "https://www.vishay.com/docs/28758/tnpw_e3.pdf",
      "revision": "2026-04-10",
      "verifiedOn": "2026-10-24",
      "pages": [
        1,
        2,
        3,
        4
      ],
      "category": "datasheet",
      "organization": "Vishay"
    }
  ],
  "scope": "TNPW e3 preferred values only; excludes TNPU, special/custom values and 0H single-lot options. Power modes describe operating conditions, not different part numbers.",
  "defaults": {
    "package": "0805",
    "tolerancePct": 1,
    "tcrCode": "E",
    "packaging": "EA",
    "mode": "general"
  },
  "tcrCodes": [
    {
      "code": "H",
      "ppm": 50
    },
    {
      "code": "E",
      "ppm": 25
    },
    {
      "code": "X",
      "ppm": 15
    },
    {
      "code": "Y",
      "ppm": 10
    }
  ],
  "toleranceCodes": [
    {
      "code": "B",
      "pct": 0.1
    },
    {
      "code": "D",
      "pct": 0.5
    },
    {
      "code": "F",
      "pct": 1
    }
  ],
  "packaging": [
    {
      "code": "ED",
      "label": "Paper tape; 10000 pieces"
    },
    {
      "code": "EA",
      "label": "Paper tape; 5000 pieces"
    },
    {
      "code": "EC",
      "label": "Paper tape; 20000 pieces; 25/50 ppm only",
      "tcrCodes": [
        "E",
        "H"
      ]
    }
  ],
  "powerModes": [
    {
      "id": "general",
      "label": "General operation · P70",
      "ratedAtC": 70,
      "zeroAtC": 125,
      "minimumAmbientC": -55,
      "maximumAmbientC": 125,
      "condition": "P70 at ambient temperature; PCB thermal management must keep film temperature within the selected mode limit."
    },
    {
      "id": "power",
      "label": "Power operation · P70",
      "ratedAtC": 70,
      "zeroAtC": 155,
      "minimumAmbientC": -55,
      "maximumAmbientC": 155,
      "condition": "P70 at ambient temperature; PCB thermal management must keep film temperature within the selected mode limit."
    },
    {
      "id": "advanced",
      "label": "Advanced operation · P70",
      "ratedAtC": 70,
      "zeroAtC": 175,
      "minimumAmbientC": -55,
      "maximumAmbientC": 175,
      "condition": "P70 at ambient temperature; PCB thermal management must keep film temperature within the selected mode limit."
    }
  ],
  "packages": [
    {
      "code": "0201",
      "case": "0201",
      "model": "TNPW0201",
      "powerW": {
        "general": 0.05,
        "power": 0.075
      },
      "workingVoltageV": 25,
      "packagingCodes": [
        "ED"
      ],
      "limits": [
        {
          "tcrCodes": [
            "E"
          ],
          "tolerancesPct": [
            0.1
          ],
          "minOhms": 22,
          "maxOhms": 25000,
          "series": [
            "E24",
            "E192"
          ]
        },
        {
          "tcrCodes": [
            "E"
          ],
          "tolerancesPct": [
            0.5
          ],
          "minOhms": 22,
          "maxOhms": 40000,
          "series": [
            "E24",
            "E192"
          ]
        }
      ]
    },
    {
      "code": "0402",
      "case": "0402",
      "model": "TNPW0402",
      "powerW": {
        "general": 0.07,
        "power": 0.105,
        "advanced": 0.13
      },
      "workingVoltageV": 75,
      "packagingCodes": [
        "ED"
      ],
      "limits": [
        {
          "tcrCodes": [
            "H"
          ],
          "tolerancesPct": [
            0.1
          ],
          "minOhms": 47,
          "maxOhms": 100000,
          "series": [
            "E24",
            "E192"
          ]
        },
        {
          "tcrCodes": [
            "H"
          ],
          "tolerancesPct": [
            0.5
          ],
          "minOhms": 10,
          "maxOhms": 100000,
          "series": [
            "E24",
            "E192"
          ]
        },
        {
          "tcrCodes": [
            "H"
          ],
          "tolerancesPct": [
            1
          ],
          "minOhms": 10,
          "maxOhms": 100000,
          "series": [
            "E24",
            "E96"
          ]
        },
        {
          "tcrCodes": [
            "E"
          ],
          "tolerancesPct": [
            0.1
          ],
          "minOhms": 10,
          "maxOhms": 100000,
          "series": [
            "E24",
            "E192"
          ]
        },
        {
          "tcrCodes": [
            "E"
          ],
          "tolerancesPct": [
            0.5
          ],
          "minOhms": 10,
          "maxOhms": 100000,
          "series": [
            "E24",
            "E192"
          ]
        },
        {
          "tcrCodes": [
            "E"
          ],
          "tolerancesPct": [
            1
          ],
          "minOhms": 10,
          "maxOhms": 100000,
          "series": [
            "E24",
            "E96"
          ]
        },
        {
          "tcrCodes": [
            "X"
          ],
          "tolerancesPct": [
            0.1
          ],
          "minOhms": 47,
          "maxOhms": 100000,
          "series": [
            "E24",
            "E192"
          ]
        },
        {
          "tcrCodes": [
            "Y"
          ],
          "tolerancesPct": [
            0.1
          ],
          "minOhms": 47,
          "maxOhms": 100000,
          "series": [
            "E24",
            "E192"
          ]
        }
      ]
    },
    {
      "code": "0603",
      "case": "0603",
      "model": "TNPW0603",
      "powerW": {
        "general": 0.11,
        "power": 0.17,
        "advanced": 0.21
      },
      "workingVoltageV": 100,
      "packagingCodes": [
        "EA",
        "EC"
      ],
      "limits": [
        {
          "tcrCodes": [
            "H"
          ],
          "tolerancesPct": [
            0.1
          ],
          "minOhms": 3.5,
          "maxOhms": 332000,
          "series": [
            "E24",
            "E192"
          ]
        },
        {
          "tcrCodes": [
            "H"
          ],
          "tolerancesPct": [
            0.5
          ],
          "minOhms": 1,
          "maxOhms": 332000,
          "series": [
            "E24",
            "E192"
          ]
        },
        {
          "tcrCodes": [
            "H"
          ],
          "tolerancesPct": [
            1
          ],
          "minOhms": 1,
          "maxOhms": 332000,
          "series": [
            "E24",
            "E96"
          ]
        },
        {
          "tcrCodes": [
            "E"
          ],
          "tolerancesPct": [
            0.1
          ],
          "minOhms": 3.5,
          "maxOhms": 332000,
          "series": [
            "E24",
            "E192"
          ]
        },
        {
          "tcrCodes": [
            "E"
          ],
          "tolerancesPct": [
            0.5
          ],
          "minOhms": 1,
          "maxOhms": 332000,
          "series": [
            "E24",
            "E192"
          ]
        },
        {
          "tcrCodes": [
            "E"
          ],
          "tolerancesPct": [
            1
          ],
          "minOhms": 1,
          "maxOhms": 332000,
          "series": [
            "E24",
            "E96"
          ]
        },
        {
          "tcrCodes": [
            "X"
          ],
          "tolerancesPct": [
            0.1
          ],
          "minOhms": 47,
          "maxOhms": 332000,
          "series": [
            "E24",
            "E192"
          ]
        },
        {
          "tcrCodes": [
            "Y"
          ],
          "tolerancesPct": [
            0.1
          ],
          "minOhms": 47,
          "maxOhms": 332000,
          "series": [
            "E24",
            "E192"
          ]
        }
      ]
    },
    {
      "code": "0805",
      "case": "0805",
      "model": "TNPW0805",
      "powerW": {
        "general": 0.14,
        "power": 0.22,
        "advanced": 0.26
      },
      "workingVoltageV": 150,
      "packagingCodes": [
        "EA",
        "EC"
      ],
      "limits": [
        {
          "tcrCodes": [
            "H"
          ],
          "tolerancesPct": [
            0.1
          ],
          "minOhms": 3.5,
          "maxOhms": 1000000,
          "series": [
            "E24",
            "E192"
          ]
        },
        {
          "tcrCodes": [
            "H"
          ],
          "tolerancesPct": [
            0.5
          ],
          "minOhms": 1,
          "maxOhms": 1000000,
          "series": [
            "E24",
            "E192"
          ]
        },
        {
          "tcrCodes": [
            "H"
          ],
          "tolerancesPct": [
            1
          ],
          "minOhms": 1,
          "maxOhms": 1000000,
          "series": [
            "E24",
            "E96"
          ]
        },
        {
          "tcrCodes": [
            "E"
          ],
          "tolerancesPct": [
            0.1
          ],
          "minOhms": 3.5,
          "maxOhms": 1000000,
          "series": [
            "E24",
            "E192"
          ]
        },
        {
          "tcrCodes": [
            "E"
          ],
          "tolerancesPct": [
            0.5
          ],
          "minOhms": 1,
          "maxOhms": 1000000,
          "series": [
            "E24",
            "E192"
          ]
        },
        {
          "tcrCodes": [
            "E"
          ],
          "tolerancesPct": [
            1
          ],
          "minOhms": 1,
          "maxOhms": 1000000,
          "series": [
            "E24",
            "E96"
          ]
        },
        {
          "tcrCodes": [
            "X"